{
  "schema_version": "1.0",
  "campaign_id": "codira-efficacy-pilot-006",
  "stage": "pilot",
  "task_ids": ["symbols-001", "patch-001", "documentation-001"],
  "seed": 20260923,
  "budgets": {
    "max_total_tokens": 240000,
    "max_output_tokens": 32000,
    "timeout_seconds": 900
  },
  "provider": {
    "name": "openrouter",
    "model": "deepseek/deepseek-v4.1-flash",
    "reasoning_effort": "medium",
    "wire_api": "responses",
    "max_prompt_usd_per_million": 0.15,
    "max_completion_usd_per_million": 0.6
  },
  "accounting": {
    "max_daily_spend_usd": 6,
    "max_estimated_attempt_spend_usd": 0.18,
    "max_estimated_pilot_spend_usd": 1.08,
    "max_response_requests_per_attempt": 10,
    "max_transport_attempts_per_response": 2,
    "max_total_tokens_scope": "whole-session"
  },
  "resource_controls": {
    "network": "none",
    "read_only_rootfs": true,
    "pids_limit": 512,
    "tmpfs_size_mib": 128
  },
  "runtime_image": "localhost/codira-phase6-onnx@sha256:5974404d2dec3f1e02b962195d7023de1affcf86183559868fd18f1a3445e1dd",
  "runtime_profile_fingerprint": "505d9aa2d761657199fa63de526dea33c1e4aacef030c2f45e3216526643f680",
  "treatment_protocol": {
    "version": "mcp-required-v2",
    "agent_instruction": "Treat identifiers as case-sensitive: copy exact spellings from inspected source and verify them before the final answer. The fixture is history-free with its baseline staged, so use git diff for edits but do not expect Git history or remotes. For behavior changes, first run the smallest reproduction using the standard library or tools already present; do not install dependencies or attempt network access. For workspace-diff tasks, edit the workspace, run a focused check, inspect the diff, and stop; do not spend the bounded session on broad exploration.",
    "codira_mcp_instruction": "Before shell search, call index_status and require usable=true, a positive indexed_file_count, ready non-partial generation, and zero failed files. Then use context_for_task or the narrowest Codira tool before broader search. Omit cursor unless continuing with an exact returned next_cursor; never send an empty cursor. If the index is unusable, stop Codira calls and report the infrastructure defect instead of treating no matches as repository evidence."
  },
  "visibility": "public"
}
